{
  "$schema": "http://json-schema.org/draft-07/schema#",
  "$id": "skills/appbox-intake/intake.schema.json",
  "title": "appbox intake answers",
  "description": "What the intake engine ELICITS — never generates. Each field records who supplied it: 'client' (stated by the client), 'founder' (stated by the founder), or 'inferred' (could not be elicited; a placeholder the emitted brief MUST flag for confirmation). The engine turns a document conforming to this schema into docs/design/brief.md plus a seeded registry.json. Recording content here that was not elicited is the single violation this schema exists to prevent (architecture §22: intake elicits; it does not generate).",
  "type": "object",
  "required": [
    "product",
    "audience",
    "appMustDo",
    "targets",
    "surfaces"
  ],
  "additionalProperties": false,
  "properties": {
    "product": {
      "$ref": "#/definitions/field",
      "description": "One line: what the app is."
    },
    "audience": {
      "$ref": "#/definitions/field",
      "description": "Who the app is for, in JTBD format: 'When [situation], I want [motivation], so I can [outcome]'."
    },
    "appMustDo": {
      "$ref": "#/definitions/fieldList",
      "description": "The (up to three) things the app must do. Elicited, not invented."
    },
    "existingSystems": {
      "$ref": "#/definitions/field",
      "description": "What exists today that this replaces or integrates with."
    },
    "targets": {
      "$ref": "#/definitions/field",
      "description": "Platform-only targets (architecture §11); viewports derive. value is an array of platform strings."
    },
    "locales": {
      "$ref": "#/definitions/fieldList",
      "description": "Target locales (BCP-47-ish, e.g. en, pl — not regex-validated). Rendered immediately after Targets. Optional."
    },
    "brand": {
      "$ref": "#/definitions/field",
      "description": "Name, colour, voice — only if the client stated one."
    },
    "direction": {
      "$ref": "#/definitions/directionField",
      "description": "Design direction: adjectives to aim for and anti-goals to avoid. Rendered after Brand. Optional."
    },
    "contentAnchors": {
      "$ref": "#/definitions/fieldList",
      "description": "Real content anchors — actual names, labels, items the design must use, not lorem. Rendered after Design direction. Optional."
    },
    "constraints": {
      "$ref": "#/definitions/fieldList",
      "description": "Hard constraints: deadlines, compliance, offline, etc."
    },
    "outOfScope": {
      "$ref": "#/definitions/fieldList",
      "description": "What the client explicitly said this app is NOT."
    },
    "layoutTemplate": {
      "$ref": "#/definitions/layoutTemplateField",
      "description": "The Layout Template picked at intake (vocabulary: Layout Template, Named Container, Rung): category from the closed list, archetype from the six-archetype gallery, copied VERBATIM from layout_templates.json — never composed or edited at intake. Optional; omit when the client declines."
    },
    "flows": {
      "type": "array",
      "items": {
        "$ref": "#/definitions/flow"
      },
      "description": "The user journeys, wiring declared surfaces into linear chains. Optional: when absent the engine DERIVES one draft flow per shell, marked provenance inferred — confirm with `appbox intake flows confirm`."
    },
    "personas": {
      "type": "array",
      "description": "The user types the client named — VARIABLE N, as many as they have. Optional and ABSENT on every project created before Slice B, which must keep emitting: absent yields personas.json = [], never an error. Do NOT derive these from `audience`: that field is one JTBD sentence with no name, role or goals, so a persona built from it would be invention wearing the authority of elicitation (§22). Never padded to three — a padded persona is indistinguishable from an elicited one once it is on a card.",
      "items": {
        "$ref": "#/definitions/persona"
      }
    },
    "map": {
      "type": "object",
      "description": "Where appbox-story-mapper DEPOSITS its story map: {releases, epics[{name, features[{name, stories[{name, priority, release}]}]}]}. Intake does not elicit this and does not own it — it republishes it to intake/map.json with content-derived ids and counts baked in. Shape: skills/appbox-story-mapper/story-map.schema.json. Declared here because this schema is additionalProperties:false at the top level, so an answers document carrying the group would otherwise be schema-illegal while the Dart validator accepted it — silent drift between the two.",
      "additionalProperties": true
    },
    "moodboard": {
      "type": "object",
      "description": "Where appbox-moodboarder DEPOSITS its moodboard: {provenance (free-text method), boards[{id, title, slice, informs, references[...]}]}. Republished to intake/moodboard.json with shot id/src precomputed. Shape: skills/appbox-moodboarder/moodboard.schema.json. Declared here for the same reason as `map`.",
      "additionalProperties": true
    },
    "surfaces": {
      "type": "array",
      "description": "The registry seed — what the client wants named. surface is ALWAYS null in a seed: intake names, it never designs (§22). comp is derived by convention at emit time, never authored here.",
      "items": {
        "$ref": "#/definitions/surface"
      }
    }
  },
  "definitions": {
    "provenance": {
      "type": "string",
      "enum": [
        "client",
        "founder",
        "inferred"
      ],
      "description": "Who supplied this field. 'inferred' = NOT elicited; a placeholder the brief must visibly flag. There is no fourth value — 'guessed', 'assumed', 'default' are all 'inferred'."
    },
    "field": {
      "type": "object",
      "required": [
        "value",
        "provenance"
      ],
      "additionalProperties": false,
      "properties": {
        "value": {
          "type": [
            "string",
            "array"
          ]
        },
        "provenance": {
          "$ref": "#/definitions/provenance"
        }
      }
    },
    "persona": {
      "type": "object",
      "description": "One user type, as the client described them. Slice B2.",
      "required": [
        "name",
        "provenance"
      ],
      "additionalProperties": true,
      "properties": {
        "id": {
          "type": "string",
          "description": "DERIVED at emit time as `persona-<slug(name)>` — do not author it. An explicit id still wins, the same override story_map.dart allows a feature to pin its surface id."
        },
        "name": {
          "type": "string",
          "description": "What the client calls this user type, in their words. Must be unique: two personas with the same name derive the same id and one would shadow the other."
        },
        "role": {
          "type": "string"
        },
        "goals": {
          "type": "array",
          "items": {
            "type": "string"
          }
        },
        "frustrations": {
          "type": "array",
          "items": {
            "type": "string"
          }
        },
        "contexts": {
          "type": "array",
          "items": {
            "type": "string"
          },
          "description": "Where and when they use it ('phone between meetings')."
        },
        "proficiency": {
          "type": "string",
          "description": "Deliberately NOT a closed vocabulary. `states` is closed because a gate matches on it; nothing matches on proficiency, and a three-word scale invented here would reject a client who said 'power user'."
        },
        "accessibility": {
          "type": "string",
          "description": "Access needs the client stated. Absent means unstated, which must not be read as 'none'."
        },
        "provenance": {
          "$ref": "#/definitions/provenance"
        }
      }
    },
    "fieldList": {
      "type": "object",
      "required": [
        "value",
        "provenance"
      ],
      "additionalProperties": false,
      "properties": {
        "value": {
          "type": "array",
          "items": {
            "type": "string"
          }
        },
        "provenance": {
          "$ref": "#/definitions/provenance"
        }
      }
    },
    "directionField": {
      "type": "object",
      "required": [
        "value",
        "provenance"
      ],
      "additionalProperties": false,
      "properties": {
        "value": {
          "type": "object",
          "additionalProperties": false,
          "properties": {
            "adjectives": {
              "type": "array",
              "items": {
                "type": "string"
              },
              "description": "Words the design should feel like."
            },
            "avoids": {
              "type": "array",
              "items": {
                "type": "string"
              },
              "description": "Anti-goals — what the design must NOT feel like."
            }
          }
        },
        "provenance": {
          "$ref": "#/definitions/provenance"
        }
      }
    },
    "layoutTemplateField": {
      "type": "object",
      "required": [
        "value",
        "provenance"
      ],
      "additionalProperties": false,
      "properties": {
        "value": {
          "type": "object",
          "required": [
            "category",
            "archetype",
            "areas",
            "containers"
          ],
          "additionalProperties": false,
          "properties": {
            "category": {
              "type": "string",
              "enum": [
                "ecommerce",
                "social",
                "productivity",
                "dashboard",
                "editorial",
                "landing",
                "custom"
              ],
              "description": "Closed category list (layout_templates.json)."
            },
            "archetype": {
              "type": "string",
              "enum": [
                "feed",
                "list-detail",
                "supporting-pane",
                "dashboard",
                "hero-scroll",
                "detail-column"
              ],
              "description": "One of the six archetypes (layout_templates.json)."
            },
            "areas": {
              "type": "object",
              "required": [
                "compact",
                "medium",
                "expanded"
              ],
              "additionalProperties": false,
              "properties": {
                "compact": {
                  "type": "array",
                  "items": {
                    "type": "string"
                  }
                },
                "medium": {
                  "type": "array",
                  "items": {
                    "type": "string"
                  }
                },
                "expanded": {
                  "type": "array",
                  "items": {
                    "type": "string"
                  }
                }
              },
              "description": "CSS grid-template-areas per rung of the viewport ladder (compact 390 / medium 744 / expanded 1280); each array item is one quoted row."
            },
            "containers": {
              "type": "object",
              "description": "Named Container sidecar: container name (closed vocabulary) -> {type, hints}."
            }
          }
        },
        "provenance": {
          "$ref": "#/definitions/provenance"
        }
      }
    },
    "surface": {
      "type": "object",
      "required": [
        "id",
        "label",
        "shell",
        "provenance"
      ],
      "additionalProperties": false,
      "properties": {
        "id": {
          "type": "string",
          "pattern": "^[a-z][a-z0-9]*\\.[a-z][a-z0-9]*$",
          "description": "<shell>.<short>, lowercase dotted, permanent (declare-structure naming). Renaming breaks every downstream reference."
        },
        "label": {
          "type": "string",
          "description": "Human label shown in lists."
        },
        "shell": {
          "type": "string",
          "pattern": "^[a-z][a-z0-9]*$",
          "description": "The shell group this surface belongs to; MUST equal the id's first segment."
        },
        "route": {
          "type": "string",
          "pattern": "^/",
          "description": "Optional route override (e.g. /product/:id). Omit — the engine derives /<short> by convention."
        },
        "requiresAuth": {
          "type": "boolean",
          "description": "Optional: the screen sits behind sign-in. Carried into the registry when true (additive)."
        },
        "tab": {
          "type": "boolean",
          "description": "Optional: bottom-tab membership (the scaffolder's shell group). Carried into the registry when true (additive)."
        },
        "states": {
          "type": "array",
          "items": {
            "type": "string",
            "enum": [
              "loading",
              "empty",
              "error"
            ]
          },
          "description": "Optional per-surface states. CONTRACT PAIR: this enum is the same closed set, in the same order, as `surfaceStates` in appboxd/lib/intake.dart, which is what actually rejects a synonym — nothing loads this schema, so drift here is invisible. Closed on purpose: an open list let every project invent 'skeleton'/'pending'/'blank' that no kit implements. Carried into the registry seed as an additive key when non-empty."
        },
        "provenance": {
          "$ref": "#/definitions/provenance"
        }
      }
    },
    "edge": {
      "type": "object",
      "description": "One transition in a flow. CONTRACT PAIR: this property set is the same closed set as `edgeKeys` in appboxd/lib/intake.dart, which is what actually rejects unknown keys — nothing loads this schema, so drift here is invisible. Change both together, or emitted flows.json will violate its own published schema (it already did for `element` and `feedback`).",
      "required": [
        "from",
        "to",
        "trigger"
      ],
      "additionalProperties": false,
      "properties": {
        "from": {
          "type": "string",
          "description": "A declared surface id."
        },
        "to": {
          "type": "string",
          "description": "A declared surface id."
        },
        "trigger": {
          "type": "string",
          "description": "The user gesture or system event that takes this edge, in the client's words."
        },
        "action": {
          "type": "string",
          "enum": [
            "push",
            "replace",
            "back",
            "modal",
            "system"
          ],
          "description": "Typed nav op (default push). system = non-gesture edge (auth-success, deep-link) — a route guard downstream, never a button."
        },
        "element": {
          "type": "string",
          "minLength": 1,
          "description": "OPTIONAL. The thing a user touches to take this edge, joining to a `data-el` value on the surface (e.g. \"button:Continue\"). It exists because `trigger` is prose written for a human reader. The flow-walk island matches this EXACTLY and falls back to a fuzzy `trigger` match when it is absent, so omitting it degrades matching rather than breaking the flow. Never derived — guessing which button an edge fires is generation (§22)."
        },
        "feedback": {
          "type": "object",
          "required": [
            "kind",
            "text"
          ],
          "additionalProperties": false,
          "description": "OPTIONAL. The toast this transition fires. It lives on the EDGE and never in a screen's `states`, because a toast is a consequence of moving, not a way a screen can look (maps to kit/ui_library; `states` maps to kit/state).",
          "properties": {
            "kind": {
              "type": "string",
              "enum": [
                "success",
                "error",
                "info"
              ],
              "description": "Closed set. The renderer derives the tick/styling from this — the text never carries them."
            },
            "text": {
              "type": "string",
              "minLength": 1,
              "description": "The words the user actually reads. When intake DERIVES a feedback it copies the trigger verbatim and stamps `inferred: true`; rewriting the trigger into nicer copy would be generation (§22)."
            },
            "inferred": {
              "type": "boolean",
              "description": "Present and true only on a feedback intake derived rather than elicited. The confirm step exists to strike it."
            },
            "action": {
              "type": "object",
              "required": [
                "label",
                "trigger"
              ],
              "additionalProperties": false,
              "description": "OPTIONAL. The button ON the toast — a snackbar's defining feature (a recoverable error with a Retry is core snackbar material, which is why `error` is a legitimate kind). NOT the same thing as the edge's own `action`, which is the typed nav op. CONTRACT PAIR with `feedbackActionKeys` in appboxd/lib/intake.dart. Never derived — inventing a button the client did not ask for is generation (§22).",
              "properties": {
                "label": {
                  "type": "string",
                  "minLength": 1,
                  "description": "The words on the button, e.g. \"Retry\"."
                },
                "trigger": {
                  "type": "string",
                  "minLength": 1,
                  "description": "What taking it does, in the client's words — same prose vocabulary as the edge's `trigger`, and deliberately NOT a surface id: the canonical case (Retry) re-runs the failed operation rather than navigating anywhere."
                }
              }
            }
          }
        }
      }
    },
    "flow": {
      "type": "object",
      "required": [
        "id",
        "name",
        "provenance",
        "edges"
      ],
      "additionalProperties": false,
      "properties": {
        "id": {
          "type": "string",
          "pattern": "^flow-[a-z0-9]+(-[a-z0-9]+)*$"
        },
        "name": {
          "type": "string"
        },
        "provenance": {
          "$ref": "#/definitions/provenance"
        },
        "edges": {
          "type": "array",
          "minItems": 1,
          "items": {
            "$ref": "#/definitions/edge"
          },
          "description": "A LINEAR chain: <=1 outgoing and <=1 incoming edge per screen. No branches, loops or self-edges; a screen may appear in many flows."
        }
      }
    }
  }
}
